{"contract_name":"retrieval_source_envelope","contract_version":1,"campaign_id":"campaign_alpha","revision_id":"revision_12","session_id":"session_alpha","retrieval_policy_version":1,"citations":[{"citation_id":"citation_one","source_id":"entity_station","authority":"canon","order":1,"excerpt_count":1,"excerpts":[{"excerpt_id":"excerpt_one","text":"Station status confirmed.","digest":"aaaaaaaaaaaaaaaaaaaaaaaaaaaaaaaaaaaaaaaaaaaaaaaaaaaaaaaaaaaaaaaa","byte_count":25,"character_count":25}]}],"source_count":1,"excerpt_count":1,"source_set_digest":"bbbbbbbbbbbbbbbbbbbbbbbbbbbbbbbbbbbbbbbbbbbbbbbbbbbbbbbbbbbbbbbb"}
